commit	tpit_ms	status	description
e967280	7.241	discard	tune MLA decode Q projection/RoPE/concat/FP8 Triton num_warps from default to 1; quality passed and exact count 1016/1016 but clearly regressed vs kept 7.166
env-flashinfer-autotune	7.810	discard	set --kernel-config.enable_flashinfer_autotune=True with baseline cudnn/mnnvl flat decode; quality passed and exact count 1016/1016 but regressed badly vs disabled autotune kept 7.166
8614adc	7.167	discard	tune kept raw CUDA MLA prep CTA size from 1024 to 768 threads; quality passed and exact count 1016/1016 but no clear win vs kept 7.166
792a330	7.193	discard	tune MLA decode Q projection/RoPE/concat/FP8 Triton BLOCK_N from 32 to 16; quality passed and exact count 1016/1016 but regressed vs kept 7.166
env-maxseq1	7.347	discard	add --max-num-seqs 1 --max-num-batched-tokens 1024 to baseline flat decode server; quality passed and exact count 1016/1016 but regressed vs default scheduler config kept 7.166
1756fc2	7.180	keep	retest current source after offline local-snapshot restart with flashinfer-cudnn+mnnvl; quality passed and exact metric count 1016/1016; no improvement vs logged 7.166 best
a195a16	7.170	discard	avoid flat MoE router logits fp32 cast; quality passed and exact counts 1016/1016, repeat 7.170ms but no clear improvement vs logged 7.166 best
be55332	7.181	discard	set FlashInfer FP4 MoE tune_max_num_tokens=1 under current source; full GSM8K passed accuracy 0.9560 invalid 0.0000, exact counts 1016/1016, but TPIT 7.183/7.181 regressed vs 7.166 best
96e42ae	7.196	discard	tune MLA decode Q projection/RoPE/concat/FP8 Triton BLOCK_N from 32 to 128; quality passed and exact count 1016/1016, but runs 7.227/7.196 regressed vs kept 7.166
188afd6	7.208	discard	tune MLA decode Q projection/RoPE/concat/FP8 Triton num_warps to 8; quality passed and exact count 1016/1016, but runs 7.208/7.230 regressed vs kept 7.166
bf6e0f6	7.161	keep	specialize large_context_topk_physical seq_len<=TopK branch to write physical indices directly; quality passed and exact counts 1016/1016, runs 7.179/7.163/7.171/7.241-noise/7.165/7.161; full GSM8K passed accuracy 0.956027 invalid 0.0 latency 706s concurrency 32
4ccb374	7.163	discard	skip clearing unused topk slots for seq_len<TopK and rely on valid_counts; quality passed and exact counts 1016/1016, but runs 7.163/7.173/7.175/7.164 did not improve vs kept bf6e0f6 7.161 and one client stream emitted 128 chunks
3892551	7.166	discard	specialize large_context_topk_physical block_size==64 division/modulo to shift/mask; quality passed and exact counts 1016/1016, but runs 7.222/7.166/7.170/7.174 did not improve vs kept bf6e0f6 7.161
6f5a7c5	0.000	discard	skip sparse indexer logits for seq_len<=TopK; quick quality passed but full GSM8K regressed accuracy 0.952995 vs expected 0.956027, invalid 0, concurrency 32
d7176b18	0.000	note	full GSM8K after reverting 6f5a7c5: current tree identical to bf6e0f6; concurrent wrapper scores 0.947688 then 0.951478 (invalid 0, errors 0, concurrency 32); repeat is within expected lm_eval stderr but samples show batching-sensitive answers; lm_eval package unavailable
d7176b18	7.161	keep	retest current tree after reverting sparse-indexer skip; quick quality passed; full GSM8K wrapper repeat 0.951478 within expected stderr but noisy; exact TPIT runs 7.188/7.161/7.162 count 1016/1016
fa589f8	7.064	keep	reuse first short physical topk result across layers within a decode step while still computing per-layer indexer logits; quick quality passed; GSM8K first/repeat 0.947688/0.953753 invalid 0 errors 0, repeat within expected stderr; exact TPIT runs 7.068/7.064/7.068/7.074 plus post-eval 7.066/7.073 count 1016/1016
284f055	6.764	keep	skip sparse indexer q quant/logits/topk for pure decode when max seq_len<=topk while still updating indexer K cache; quick quality passed; full GSM8K passed accuracy 0.953753 invalid 0 errors 0 latency 655s concurrency 32; exact TPIT runs 6.864/6.765/6.768/6.764 plus post-eval 6.862/6.775 count 1016/1016
9b81cb1	6.779	discard	avoid q_fp8/scaled_index_weights allocations on short decode path; quick quality passed and exact counts 1016/1016, but runs 6.800/6.779/6.782 regressed vs kept 284f055 6.764
7a82ceb	6.527	keep	skip sparse indexer Q projection and q/index_q fused output for pure decode when max seq_len<=topk, while retaining K cache update and all-token physical topk; quick quality passed; full GSM8K passed accuracy 0.952995 invalid 0 errors 0 latency 661s concurrency 32; exact TPIT runs 6.566/6.527/6.533 plus post-eval 6.528/6.542 count 1016/1016
4da1b05	6.517	keep	trim qkv+wk fused projection to qkv+indexer-K only for short decode, avoiding unused indexer weight outputs; quick quality passed; exact TPIT runs 6.523/6.525/6.673-noise/6.526/6.517/6.539 count 1016/1016; full GSM8K covered previous same-guard semantic path at 7a82ceb
0091b57	6.529	discard	tune short indexer K norm/RoPE/cache Triton kernel to num_warps=8; quick quality passed and exact counts 1016/1016, but runs 6.531/6.540/6.529 regressed vs kept 4da1b05 6.517
3c12aac	6.517	discard	tune short indexer K norm/RoPE/cache Triton kernel to num_warps=2; quick quality passed and exact counts 1016/1016, but runs 6.560/6.518/6.517 gave no clear improvement vs kept 4da1b05 6.517
3cc9ba0	6.736	discard	split short decode qkv onto min_latency path and compute indexer-K separately; quick quality passed and exact counts 1016/1016, but runs 6.737/6.740/6.736 regressed vs kept 4da1b05 6.517
8dd1240	0.000	note	full GSM8K quality gate on current reverted source: bounded concurrency=32 wrapper passed accuracy 0.951478 invalid 0 errors 0 latency 657s; within expected stderr band and matches prior warmed current-tree score; earlier unbounded wrapper run was invalid with all API errors
5fc744d	0.000	crash	tune short_context_topk_physical launch from 1024 to 256 threads; startup dummy run failed with short_context_topk_physical kernel invalid argument, reverted in 6412019
dd7b3f7	6.513	discard	add short_context_topk_physical to avoid dummy logits allocation on short decode; quality passed and exact counts 1016/1016, but runs 6.513/6.593/6.560/6.517/6.639/6.713/6.516/6.520 did not clearly improve vs kept 4da1b05 6.517; reverted in bc472b9
d84d8f6	6.521	discard	avoid first-layer residual clone by reusing embedding tensor as residual; quick quality passed and exact counts 1016/1016, but runs 6.521/6.563/6.522 did not improve vs kept 4da1b05 6.517; reverted in 3ae15dd
b0a2e22	6.519	discard	use vocab-parallel local argmax fast path for flat DeepSeek plain greedy sampling to avoid full-logit gather; quick quality passed and exact counts 1016/1016, but runs 6.526/6.582/6.519 did not improve vs kept 4da1b05 6.517; reverted in 3509f6f
7458bd1	6.523	discard	disable FlashInfer fused allreduce one-shot mode for SM103 TP4 to force two-shot path; quick quality passed and exact counts 1016/1016, but runs 6.687/6.523/6.528 regressed or noised vs kept 4da1b05 6.517 and one client stream emitted 128 chunks; reverted in b92d641
0ae65ea	6.521	discard	tune short indexer K norm/RoPE/cache Triton kernel to num_stages=1; quick quality passed and exact counts 1016/1016, but runs 6.524/6.620/6.526/6.521/6.525 did not improve vs kept 4da1b05 6.517; reverted in 4f781c4
ca12455	6.499	keep	route short decode fused qkv+indexer-K BF16 projection through extended dsv3 fused-A GEMM supporting 2240 output; quick quality passed and exact counts 1016/1016, runs 6.509/6.504/6.499/6.516/6.518 plus post-eval 6.517/6.508/6.505 vs kept 4da1b05 6.517; full GSM8K passed accuracy 0.952995 invalid 0 errors 0 latency 642s concurrency 32
974fb80	6.453	keep	route q_b_proj 1536->6144 BF16 projection through extended dsv3 fused-A GEMM; quick quality passed and exact metric counts 1016/1016, runs 6.453/6.458/6.624-noise/6.504/6.453 with two coalesced client streams but valid Prometheus counts vs kept ca12455 6.499; full GSM8K passed accuracy 0.956027 invalid 0 errors 0 latency 653s concurrency 32
96c6215	6.451	discard	tune fused-A GEMM token tile from 8 to 4 for num_tokens<=4 across qkv/qkv+indexer-K/q_b shapes; direct CUDA smoke and quick quality passed with exact counts 1016/1016, but runs 6.451/6.456/6.469/6.453/6.673-noise did not improve vs kept 974fb80 post-eval 6.446
env-trtllm-pdl	6.311	keep	enable TRTLLM programmatic dependent launch for dsv3 fused-A GEMM via TRTLLM_ENABLE_PDL=1; quick quality passed and exact counts 1016/1016, runs 6.311/6.313/6.330/6.319/6.320 vs kept 974fb80 post-eval 6.446
10c2c02	6.372	keep	enable PDL by default for dsv3 fused-A GEMM when TRTLLM_ENABLE_PDL is unset; direct CUDA smoke and quick quality passed, exact counts 1016/1016, runs 6.374/6.374/6.376/6.555-noise/6.372 improve vs kept 974fb80 no-env 6.446 but explicit env-trtllm-pdl remains faster at 6.311 likely via other TRTLLM kernels
86152fe	6.305	keep	enable PDL by default for DSV3 router GEMM when TRTLLM_ENABLE_PDL is unset; direct CUDA router smoke and quick quality passed, exact counts 1016/1016, runs 6.308/6.316/6.305/6.328/6.314 with one coalesced client stream but valid Prometheus counts; matches explicit env-trtllm-pdl result
5e7406e	6.300	discard	tune DSV3 router GEMM from 128 to 224 threads to reduce K iterations; direct router smoke and quick quality passed, exact counts 1016/1016, runs 6.355-noise/6.301/6.300/6.307/6.314 were not a clear win vs kept 86152fe 6.305 and changed router reduction order
881d1d3	6.282	keep	tune dsv3 fused-A GEMM K tile from 256 to 512; direct CUDA smoke and quick quality passed; exact counts 1016/1016, runs 6.298/6.289/6.292/6.282/6.284 plus post-eval 6.285/6.290/6.324; full GSM8K passed accuracy 0.954511 invalid 0 errors 0 latency 685s concurrency 32
worktree	0.000	crash	try dsv3 fused-A GEMM K tile 1024 globally; compile failed because q_b projection gemm_k=1536 is not divisible by tile_k=1024, restored source to kept 512 tile
0bb0dc7	6.288	discard	specialize dsv3 fused-A GEMM K tile to 1024 for 7168-input qkv/indexer projections while keeping 512 for q_b; direct CUDA smoke and quick quality passed, exact counts 1016/1016, but runs 6.427-noise/6.330/6.291/6.288/6.326 did not improve vs kept 881d1d3 6.282
worktree	0.000	crash	try dsv3 fused-A GEMM q_b-only K tile 768; compile failed because kernel static_assert only permits tile_k 128/256/512/1024, restored source to kept 512 tile
db38ef0	6.344	discard	disable launch_with_pdl for flat fused allreduce+RMS call sites; quick quality passed and exact counts 1016/1016, but runs 6.351/6.353/6.346/6.549-noise/6.344 regressed vs kept 881d1d3 6.282
483d805	6.286	discard	limit flat fused allreduce+RMS max_token_num threshold to 1 for decode-only target; quick quality passed and exact counts 1016/1016, but runs 6.286/6.299/6.292/6.326/6.317 did not improve vs kept 881d1d3 6.282
d009913	6.995	discard	disable flat fused allreduce+RMS path entirely by setting threshold to 0; quick quality passed and exact counts 1016/1016, but separate allreduce plus fused RMS regressed hard with runs 7.009/6.995/6.999/7.014/6.998
23d2a4b	0.000	crash	cap dsv3 fused-A GEMM pipeline stages at 4; direct CUDA smoke passed, but vLLM service disappeared during checkpoint load before startup completed, reverted
